<?xml version="1.0" encoding="utf-8"?>
<payments xmlns:xsi="http://www.w3.org/2001/XMLSchema-instance" xsi:noNamespaceSchemaLocation="payment.xsd">
    <payment>
        <date>2023-01-30</date>
        <supplierName>Nike</supplierName>
        <invoice id="inv001"/>
        <amount>50000</amount>
        <status>paid</status>
        <payment>cash</payment>
       
    </payment>
    
</payments>